{
  "$schema": "http://json-schema.org/draft-07/schema#",
  "title": "Shiny Pancake Configuration Schema",
  "type": "array",
  "description": "An array of log archiving and rotation rules.",
  "items": {
    "type": "object",
    "required": [
      "Name",
      "SourcePath",
      "DestinationPath",
      "CleanSourceFiles",
      "Mandatory"
    ],
    "properties": {
      "Name": {
        "type": "string",
        "description": "Display name of the rule, used in log messages and receipt filenames."
      },
      "Description": {
        "type": "string",
        "description": "Free-text description of the rule. Ignored at runtime."
      },
      "SourcePath": {
        "type": "string",
        "description": "The directory containing log files to process."
      },
      "DestinationPath": {
        "type": "string",
        "description": "The directory where the output ZIP archives will be written."
      },
      "CleanSourceFiles": {
        "type": "boolean",
        "description": "If true, stages and moves matched files (rotation/cleanup mode). If false, copies matched files (keep mode)."
      },
      "Mandatory": {
        "type": "boolean",
        "description": "If true, logs a critical ERROR (exit code 2) if no files match. If false, logs an INFO message."
      },
      "FileNamePattern": {
        "type": "string",
        "description": "Regular expression pattern (regex) to filter files in the source path. If omitted, all files are processed."
      },
      "ArchiveNamePrefix": {
        "type": "string",
        "description": "Optional prefix prepended to the hostname in the archive name."
      },
      "ArchiveNameSuffix": {
        "type": "string",
        "description": "Optional suffix appended after the date in the archive name."
      },
      "DateFormat": {
        "type": "string",
        "description": "Optional .NET date format string used in the archive name. Defaults to 'dd-MM-yy'."
      },
      "CompressionLevel": {
        "type": "integer",
        "minimum": 0,
        "maximum": 9,
        "description": "7-Zip compression level (0-9). Defaults to 5 (0 = Store, 9 = Ultra)."
      },
      "ExpectedCompressionPercent": {
        "type": "integer",
        "minimum": 0,
        "maximum": 99,
        "description": "Expected size reduction (0-99) used to estimate disk space requirements. E.g. 90 means the archive is expected to be ~10% of the original size. Defaults to 0 (conservative)."
      }
    },
    "additionalProperties": false
  }
}
